{
  "id": "00000000-0000-0000-0000-000000000701",
  "user_id": "00000000-0000-0000-0000-000000000001",
  "location_enabled": true,
  "precise_location_enabled": false,
  "background_location_enabled": false,
  "radio_context_enabled": false,
  "motion_context_enabled": true,
  "device_context_enabled": true,
  "raw_location_retention_days": 7,
  "raw_radio_retention_days": null,
  "default_location_retention_policy": "short_ttl_raw",
  "default_radio_retention_policy": "derived_only",
  "per_run_context_default": true,
  "updated_at": "2026-04-26T14:00:00Z",
  "created_at": "2026-04-26T14:00:00Z"
}
